{
  "id": "material.cable-veined-stone",
  "version": "0.1.0",
  "class": "material",
  "label": "Cable-Veined Stone",
  "allowedGlyphFamilies": [
    { "family": "structural", "weight": 0.55 },
    { "family": "soft-signal", "weight": 0.20 },
    { "family": "dense-pressure", "weight": 0.15 },
    { "family": "symbolic", "weight": 0.10 }
  ],
  "edgeTreatment": "seam",
  "preferredDensityCurve": "bumpy-low",
  "preferredPaletteRoles": ["structural", "dim_support"],
  "animationCompatibility": [
    "behavior.anchor-pulse",
    "behavior.flow-field-drift",
    "behavior.ghost-trail"
  ],
  "scarAffinity": ["scar.failed-memory-extraction"],
  "notes": "Structural with embedded signal seams. Supports slow-signal drift behaviors along seams."
}
