{
  "id": "material.shrine-plating",
  "version": "0.1.0",
  "class": "material",
  "label": "Shrine Plating",
  "allowedGlyphFamilies": [
    { "family": "structural", "weight": 0.75 },
    { "family": "soft-signal", "weight": 0.15 },
    { "family": "symbolic", "weight": 0.10 }
  ],
  "edgeTreatment": "smooth",
  "preferredDensityCurve": "flat-low",
  "preferredPaletteRoles": ["structural"],
  "animationCompatibility": [
    "behavior.breath-offset",
    "behavior.core-pulse",
    "behavior.anchor-pulse",
    "behavior.relic-phase"
  ],
  "scarAffinity": ["scar.failed-memory-extraction", "scar.ritual-lock"],
  "notes": "Clean, stable, near-silent. Holds shrine motifs without noise."
}
